priority_rank,target_account,company_size_band,primary_role_lane,target_title,fit_tier,can_target_now,channel_primary,channel_secondary,trigger_hypothesis,outreach_angle,current_exec_name,status
1,Datadog,1001-10000,CFO,Chief Financial Officer,strong,yes,search-firm-referral,board-referral,AI infrastructure spend and margin pressure,Pre-search strategic clarity on mandate and company trajectory,TBD verify current holder,ready
2,Cloudflare,1001-10000,COO,Chief Operating Officer,strong,yes,search-firm-referral,investor-referral,Platform scaling and enterprise expansion,Operational health and board-aligned transition intelligence,TBD verify current holder,ready
3,Snowflake,1001-10000,CIO,Chief Information Officer,strong,yes,search-firm-referral,peer-referral,Data platform transformation mandates,Digital transformation readiness and role-risk validation,TBD verify current holder,ready
4,CrowdStrike,1001-10000,CFO,Chief Financial Officer,strong,yes,search-firm-referral,board-referral,Cyber growth versus efficiency balance,Financial and strategic signal intelligence before formal process,TBD verify current holder,ready
5,HubSpot,1001-10000,CRO,Chief Revenue Officer,strong,yes,search-firm-referral,peer-referral,GTM scaling and pipeline efficiency pressure,Revenue transition de-risking and mandate clarity,TBD verify current holder,ready
6,MongoDB,1001-10000,CFO,Chief Financial Officer,strong,yes,search-firm-referral,investor-referral,Consumption model volatility and growth planning,Company health signals and mandate validation,TBD verify current holder,ready
7,Zscaler,1001-10000,COO,Chief Operating Officer,strong,yes,search-firm-referral,board-referral,Global operating model complexity,Operational mandate intelligence pre-search,TBD verify current holder,ready
8,Okta,1001-10000,CIO,Chief Information Officer,strong,yes,search-firm-referral,peer-referral,Security and identity integration shifts,Digital org health and modernization signal tracking,TBD verify current holder,ready
9,Twilio,1001-10000,CFO,Chief Financial Officer,strong,yes,search-firm-referral,board-referral,Portfolio rationalization and margin focus,Financial mandate clarity and move-quality validation,TBD verify current holder,ready
10,DocuSign,1001-10000,CRO,Chief Revenue Officer,strong,yes,search-firm-referral,peer-referral,Enterprise GTM reset and expansion,Pre-search revenue intelligence and risk reduction,TBD verify current holder,ready
11,Zoom Video,1001-10000,COO,Chief Operating Officer,strong,yes,search-firm-referral,board-referral,Post-hypergrowth operating redesign,Operational signal intelligence before transition,TBD verify current holder,ready
12,GitLab,1001-10000,CFO,Chief Financial Officer,strong,yes,search-firm-referral,investor-referral,Public market efficiency pressure,Strategic and financial pre-search positioning,TBD verify current holder,ready
13,Elastic,1001-10000,CRO,Chief Revenue Officer,strong,yes,search-firm-referral,peer-referral,Sales productivity and enterprise expansion,Revenue role-mandate qualification before search lock-in,TBD verify current holder,ready
14,Smartsheet,1001-10000,CHRO,Chief Human Resources Officer,strong,yes,search-firm-referral,board-referral,Talent retention and org redesign,Culture and org-stability signal intelligence,TBD verify current holder,ready
15,Samsara,1001-10000,CIO,Chief Information Officer,strong,yes,search-firm-referral,peer-referral,IoT scale and platform complexity,Transformation-readiness signal validation,TBD verify current holder,ready
16,Confluent,1001-10000,CFO,Chief Financial Officer,strong,yes,search-firm-referral,board-referral,Growth investment versus profitability tradeoffs,Pre-search financial and board-context clarity,TBD verify current holder,ready
17,SentinelOne,1001-10000,CISO,Chief Information Security Officer,medium,yes,specialist-search-firm,peer-referral,Security operating maturity pressure,Compliance and security investment signal validation,TBD verify current holder,ready
18,RingCentral,1001-10000,COO,Chief Operating Officer,strong,yes,search-firm-referral,investor-referral,Enterprise execution and retention pressure,Operational health intelligence before role move,TBD verify current holder,ready
19,Five9,1001-10000,CRO,Chief Revenue Officer,strong,yes,search-firm-referral,peer-referral,Contact-center AI GTM shifts,Revenue trajectory and mandate-risk de-risking,TBD verify current holder,ready
20,Workiva,1001-10000,CFO,Chief Financial Officer,strong,yes,search-firm-referral,board-referral,Compliance-led growth and expansion choices,Financial mandate signal intelligence,TBD verify current holder,ready
21,New Relic,1001-10000,CIO,Chief Information Officer,strong,yes,search-firm-referral,peer-referral,Observability stack modernization cycles,Digital transformation and org-readiness signals,TBD verify current holder,ready
22,Rapid7,1001-10000,CISO,Chief Information Security Officer,medium,yes,specialist-search-firm,board-referral,Security platform consolidation pressure,Security posture and board support validation,TBD verify current holder,ready
23,Tenable,1001-10000,CISO,Chief Information Security Officer,medium,yes,specialist-search-firm,peer-referral,Exposure management market shifts,Security mandate and investment signal clarity,TBD verify current holder,ready
24,Dynatrace,1001-10000,CIO,Chief Information Officer,strong,yes,search-firm-referral,peer-referral,Enterprise platform transformation complexity,Transformation-readiness and move-quality validation,TBD verify current holder,ready
25,PagerDuty,1001-10000,CRO,Chief Revenue Officer,strong,yes,search-firm-referral,peer-referral,GTM efficiency and growth targets,Revenue mandate de-risking pre-search,TBD verify current holder,ready
26,Braze,1001-10000,CRO,Chief Revenue Officer,strong,yes,search-firm-referral,investor-referral,Expansion economics and vertical GTM shifts,Revenue trajectory intelligence and mandate clarity,TBD verify current holder,ready
27,Sprout Social,1001-10000,CHRO,Chief Human Resources Officer,strong,yes,search-firm-referral,peer-referral,Org scaling and talent retention needs,Culture and org-health signals for transition decisions,TBD verify current holder,ready
28,Freshworks,1001-10000,CIO,Chief Information Officer,strong,yes,search-firm-referral,peer-referral,Enterprise IT complexity and product-suite integration,Digital transformation readiness signals,TBD verify current holder,ready
29,Appian,1001-10000,COO,Chief Operating Officer,strong,yes,search-firm-referral,board-referral,Platform execution and operational leverage targets,Operational mandate and board alignment intelligence,TBD verify current holder,ready
30,UiPath,1001-10000,CFO,Chief Financial Officer,strong,yes,search-firm-referral,investor-referral,Automation market reset and margin pressure,Financial positioning and pre-search role calibration,TBD verify current holder,ready
31,Asana,1001-10000,CRO,Chief Revenue Officer,strong,yes,search-firm-referral,peer-referral,Sales efficiency and enterprise growth priorities,GTM mandate risk analysis and move validation,TBD verify current holder,ready
32,Box,1001-10000,CIO,Chief Information Officer,strong,yes,search-firm-referral,board-referral,Content platform modernization demands,Transformation-readiness and organizational stability signals,TBD verify current holder,ready
33,Dropbox,1001-10000,CFO,Chief Financial Officer,strong,yes,search-firm-referral,board-referral,Portfolio focus and capital allocation shifts,Financial and strategic signal monitoring pre-transition,TBD verify current holder,ready
34,Atlassian,1001-10000,CIO,Chief Information Officer,strong,yes,search-firm-referral,peer-referral,Cloud and AI platform operating changes,Digital transformation and role-scope validation,TBD verify current holder,ready
35,N-able,1001-10000,CRO,Chief Revenue Officer,strong,yes,search-firm-referral,peer-referral,MSP channel growth and GTM refinement,Revenue mandate quality and timing intelligence,TBD verify current holder,ready
36,Qualys,1001-10000,CISO,Chief Information Security Officer,medium,yes,specialist-search-firm,investor-referral,Security buyer behavior shifts,Security mandate clarity and board support signals,TBD verify current holder,ready
37,Nutanix,1001-10000,COO,Chief Operating Officer,strong,yes,search-firm-referral,board-referral,Hybrid cloud operating model complexity,Operational health and board-aligned role timing,TBD verify current holder,ready
38,Pure Storage,1001-10000,CFO,Chief Financial Officer,strong,yes,search-firm-referral,investor-referral,Infrastructure demand cycles and efficiency targets,Financial trajectory and role-risk validation,TBD verify current holder,ready
39,Rubrik,1001-10000,CIO,Chief Information Officer,strong,yes,search-firm-referral,peer-referral,Post-IPO operating priorities and scale demands,Transformation-readiness intelligence pre-search,TBD verify current holder,ready
40,C3.ai,1001-10000,CRO,Chief Revenue Officer,strong,yes,search-firm-referral,investor-referral,AI platform commercialization pressure,GTM mandate and trajectory signal analysis,TBD verify current holder,ready
41,Palantir,1001-10000,COO,Chief Operating Officer,strong,yes,search-firm-referral,board-referral,Large-program execution and scaling complexity,Operational stability and mandate-fit insights,TBD verify current holder,ready
42,Veeva Systems,1001-10000,CFO,Chief Financial Officer,strong,yes,search-firm-referral,board-referral,Lifecycle and vertical expansion decisions,Pre-search strategic and financial clarity,TBD verify current holder,ready
43,Procore,1001-10000,CRO,Chief Revenue Officer,strong,yes,search-firm-referral,peer-referral,Construction-tech GTM expansion pressure,Revenue transition de-risking intelligence,TBD verify current holder,ready
44,ServiceTitan,1001-10000,COO,Chief Operating Officer,strong,yes,search-firm-referral,investor-referral,Operational scale-up and process maturity,Operational mandate validation before formal search,TBD verify current holder,ready
45,Bill Holdings,1001-10000,CFO,Chief Financial Officer,strong,yes,search-firm-referral,board-referral,Fintech unit economics and growth calibration,Financial signal tracking for transition timing,TBD verify current holder,ready
46,Toast,1001-10000,CRO,Chief Revenue Officer,strong,yes,search-firm-referral,peer-referral,SMB and enterprise GTM balancing,Revenue mandate and market-position validation,TBD verify current holder,ready
47,Marqeta,1001-10000,CFO,Chief Financial Officer,strong,yes,search-firm-referral,investor-referral,Issuing platform growth and margin pressure,Financial and strategic role-fit intelligence,TBD verify current holder,ready
48,Affirm,1001-10000,CRO,Chief Revenue Officer,strong,yes,search-firm-referral,investor-referral,Consumer credit cycle and partner concentration,GTM and risk-adjusted trajectory analysis,TBD verify current holder,ready
49,SoFi,1001-10000,COO,Chief Operating Officer,strong,yes,search-firm-referral,board-referral,Multi-product operating model complexity,Operational stability and board mandate clarity,TBD verify current holder,ready
50,Robinhood,1001-10000,CISO,Chief Information Security Officer,medium,yes,specialist-search-firm,board-referral,Regulatory and security scrutiny changes,Security mandate and governance-readiness signals,TBD verify current holder,ready
51,Coinbase,1001-10000,CISO,Chief Information Security Officer,medium,yes,specialist-search-firm,investor-referral,Regulatory evolution and trust requirements,Security and compliance investment intelligence,TBD verify current holder,ready
52,Block,1001-10000,CFO,Chief Financial Officer,strong,yes,search-firm-referral,board-referral,Portfolio mix and profitability optimization,Financial mandate timing and move-quality signals,TBD verify current holder,ready
53,PayPal,10001+,CRO,Chief Revenue Officer,strong,yes,search-firm-referral,board-referral,Platform repositioning and growth mix changes,Revenue mandate clarity for pre-search decisions,TBD verify current holder,ready
54,Global Payments,10001+,COO,Chief Operating Officer,strong,yes,search-firm-referral,board-referral,Payments integration and operating leverage mandates,Operational board-context intelligence,TBD verify current holder,ready
55,Fiserv,10001+,CIO,Chief Information Officer,strong,yes,search-firm-referral,peer-referral,Core modernization and platform integration,Digital transformation and role-scope validation,TBD verify current holder,ready
56,FIS,10001+,CFO,Chief Financial Officer,strong,yes,search-firm-referral,investor-referral,Portfolio simplification and efficiency focus,Financial trajectory and mandate-fit signals,TBD verify current holder,ready
57,Paycom,1001-10000,CHRO,Chief Human Resources Officer,strong,yes,search-firm-referral,peer-referral,Talent retention and org design optimization,Culture and operating model transition intelligence,TBD verify current holder,ready
58,Paylocity,1001-10000,CRO,Chief Revenue Officer,strong,yes,search-firm-referral,peer-referral,Mid-market GTM expansion priorities,Revenue role clarity before formal process,TBD verify current holder,ready
59,ADP,10001+,CHRO,Chief Human Resources Officer,strong,yes,search-firm-referral,board-referral,Workforce and platform transformation,People strategy and board-context signal intelligence,TBD verify current holder,ready
60,Paychex,10001+,CFO,Chief Financial Officer,strong,yes,search-firm-referral,board-referral,SMB demand cycle and margin management,Financial mandate and strategic timing signals,TBD verify current holder,ready
61,Gartner,10001+,CIO,Chief Information Officer,strong,yes,search-firm-referral,peer-referral,Platform and operating model modernization,Transformation-readiness and mandate confidence,TBD verify current holder,ready
62,CDW,10001+,COO,Chief Operating Officer,strong,yes,search-firm-referral,board-referral,Distribution and services operating complexity,Operational health and role-risk intelligence,TBD verify current holder,ready
63,Insight Enterprises,10001+,CRO,Chief Revenue Officer,strong,yes,search-firm-referral,peer-referral,Services-led growth transition,Revenue trajectory signal analysis,TBD verify current holder,ready
64,Zillow,1001-10000,CFO,Chief Financial Officer,strong,yes,search-firm-referral,investor-referral,Housing cycle volatility and capital allocation,Financial clarity and transition timing intelligence,TBD verify current holder,ready
65,Redfin,1001-10000,COO,Chief Operating Officer,strong,yes,search-firm-referral,board-referral,Brokerage model efficiency and margin pressure,Operational mandate and board-alignment signals,TBD verify current holder,ready
66,Compass,1001-10000,CRO,Chief Revenue Officer,strong,yes,search-firm-referral,peer-referral,Agent productivity and market-share dynamics,Revenue mandate quality and move-risk assessment,TBD verify current holder,ready
67,Carvana,1001-10000,CFO,Chief Financial Officer,strong,yes,search-firm-referral,investor-referral,Turnaround execution and balance-sheet pressure,Financial and strategic pre-search clarity,TBD verify current holder,ready
68,CarGurus,1001-10000,CRO,Chief Revenue Officer,strong,yes,search-firm-referral,peer-referral,Marketplace monetization shifts,Revenue trajectory and role scope validation,TBD verify current holder,ready
69,Expedia Group,10001+,COO,Chief Operating Officer,strong,yes,search-firm-referral,board-referral,Travel demand volatility and operating complexity,Operational transition intelligence,TBD verify current holder,ready
70,Booking Holdings,10001+,CFO,Chief Financial Officer,strong,yes,search-firm-referral,board-referral,Capital deployment and platform growth priorities,Financial signal monitoring and role-risk validation,TBD verify current holder,ready
71,Airbnb,10001+,CRO,Chief Revenue Officer,strong,yes,search-firm-referral,peer-referral,Global GTM optimization and new supply growth,Revenue mandate de-risking pre-search,TBD verify current holder,ready
72,Etsy,1001-10000,CFO,Chief Financial Officer,strong,yes,search-firm-referral,investor-referral,Marketplace mix shifts and margin pressure,Financial strategy and transition timing signals,TBD verify current holder,ready
73,Wayfair,10001+,COO,Chief Operating Officer,strong,yes,search-firm-referral,board-referral,Supply chain and profitability focus,Operational mandate clarity and board confidence,TBD verify current holder,ready
74,eBay,10001+,CIO,Chief Information Officer,strong,yes,search-firm-referral,peer-referral,Platform modernization and trust initiatives,Digital transformation readiness and scope validation,TBD verify current holder,ready
75,DoorDash,10001+,CRO,Chief Revenue Officer,strong,yes,search-firm-referral,investor-referral,Marketplace expansion and enterprise growth,Revenue signal intelligence and move-quality validation,TBD verify current holder,ready
76,Uber,10001+,COO,Chief Operating Officer,strong,yes,search-firm-referral,board-referral,Global multi-line operating complexity,Operational health and strategic mandate signals,TBD verify current holder,ready
77,Lyft,1001-10000,CFO,Chief Financial Officer,strong,yes,search-firm-referral,investor-referral,Profitability transition and competitive pressure,Financial mandate timing and risk de-risking,TBD verify current holder,ready
78,Instacart,1001-10000,CRO,Chief Revenue Officer,strong,yes,search-firm-referral,peer-referral,Retail media and enterprise monetization shifts,Revenue mandate and trajectory clarity,TBD verify current holder,ready
79,Stryker,10001+,COO,Chief Operating Officer,strong,yes,search-firm-referral,board-referral,Global medtech operating scale and integration,Operational and board-context pre-search signals,TBD verify current holder,ready
80,Edwards Lifesciences,10001+,CFO,Chief Financial Officer,strong,yes,search-firm-referral,board-referral,Portfolio growth and margin allocation choices,Financial and strategic transition intelligence,TBD verify current holder,ready
81,Dexcom,1001-10000,CIO,Chief Information Officer,strong,yes,search-firm-referral,peer-referral,Digital health scaling and data platform complexity,Transformation-readiness and role-fit validation,TBD verify current holder,ready
82,ResMed,10001+,CIO,Chief Information Officer,strong,yes,search-firm-referral,peer-referral,Connected-care platform expansion,Digital org health and modernization signals,TBD verify current holder,ready
83,Insulet,1001-10000,CFO,Chief Financial Officer,strong,yes,search-firm-referral,investor-referral,Growth investment and margin management,Financial trajectory and role timing intelligence,TBD verify current holder,ready
84,Hologic,10001+,CHRO,Chief Human Resources Officer,strong,yes,search-firm-referral,board-referral,Talent strategy and global operating changes,People mandate and org-stability signals,TBD verify current holder,ready
85,Align Technology,10001+,CRO,Chief Revenue Officer,strong,yes,search-firm-referral,peer-referral,Channel expansion and growth optimization,Revenue trajectory validation pre-search,TBD verify current holder,ready
86,Illumina,10001+,CISO,Chief Information Security Officer,medium,yes,specialist-search-firm,board-referral,Regulatory and data-security complexity,Security governance and investment signal clarity,TBD verify current holder,ready
87,Baxter,10001+,COO,Chief Operating Officer,strong,yes,search-firm-referral,board-referral,Global supply and operating redesign demands,Operational health and mandate confidence,TBD verify current holder,ready
88,Zimmer Biomet,10001+,CFO,Chief Financial Officer,strong,yes,search-firm-referral,investor-referral,Portfolio mix and efficiency requirements,Financial strategy and move-quality signal intelligence,TBD verify current holder,ready
89,West Pharmaceutical,10001+,CIO,Chief Information Officer,strong,yes,search-firm-referral,peer-referral,Manufacturing digitization and platform upgrades,Transformation-readiness and role-scope signals,TBD verify current holder,ready
90,Moderna,1001-10000,CFO,Chief Financial Officer,strong,yes,search-firm-referral,board-referral,Post-pandemic portfolio and capital allocation shifts,Financial mandate timing and strategic clarity,TBD verify current holder,ready
91,Biogen,10001+,COO,Chief Operating Officer,strong,yes,search-firm-referral,board-referral,R&D portfolio and operating efficiency pressure,Operational board-alignment and role-risk validation,TBD verify current holder,ready
92,Vertex Pharmaceuticals,10001+,CIO,Chief Information Officer,strong,yes,search-firm-referral,peer-referral,R&D and data platform modernization,Digital transformation and scope-validation signals,TBD verify current holder,ready
93,McKesson,10001+,CRO,Chief Revenue Officer,strong,yes,search-firm-referral,board-referral,Healthcare distribution and services growth mix,Revenue mandate quality and trajectory signals,TBD verify current holder,ready
94,Cencora,10001+,COO,Chief Operating Officer,strong,yes,search-firm-referral,board-referral,Global supply-chain and integration complexity,Operational stability and transition timing intelligence,TBD verify current holder,ready
95,Cardinal Health,10001+,CFO,Chief Financial Officer,strong,yes,search-firm-referral,investor-referral,Margin and portfolio optimization pressures,Financial pre-search signal intelligence,TBD verify current holder,ready
96,DaVita,10001+,CHRO,Chief Human Resources Officer,strong,yes,search-firm-referral,peer-referral,Workforce model and retention pressure,People strategy and org-health transition signals,TBD verify current holder,ready
97,United Rentals,10001+,COO,Chief Operating Officer,strong,yes,search-firm-referral,board-referral,Cyclical demand and operating leverage priorities,Operational mandate and board-context validation,TBD verify current holder,ready
98,Cintas,10001+,CRO,Chief Revenue Officer,strong,yes,search-firm-referral,peer-referral,Service expansion and enterprise sales priorities,Revenue role timing and mandate clarity,TBD verify current holder,ready
99,Republic Services,10001+,CIO,Chief Information Officer,strong,yes,search-firm-referral,peer-referral,Operational technology and digital platform upgrades,Transformation-readiness and role-risk signals,TBD verify current holder,ready
100,Waste Management,10001+,CFO,Chief Financial Officer,strong,yes,search-firm-referral,board-referral,Capital allocation and operating efficiency balance,Financial and strategic pre-search clarity,TBD verify current holder,ready
